[
 {
  "author": {
   "name": "Charles Flower",
   "raw": "written by Charles Flower",
   "signature": null
  },
  "id": "afs-001",
  "kind": "song",
  "location": {
   "basis": null,
   "lat": null,
   "lng": null,
   "placeId": null,
   "raw": null,
   "state": null,
   "town": null
  },
  "media": {
   "audio": [],
   "images": [
    {
     "height": 283,
     "role": "notation",
     "type": "gif",
     "url": "https://folkstream.com/001.gif",
     "width": 510
    }
   ],
   "midi": [
    {
     "url": "https://folkstream.com/001.mid"
    }
   ]
  },
  "notes": {
   "links": [],
   "text": "First published in the Queenslander in 1894 Stewart and Keesing note in their Old Bush Songs : \"According to our correspondent R.C.Lethbridge this song was written by Charles Flower, who once owned a station, 'Roma Downs', in the Maranoa district\".\nThe brothers Horace and Charles Flower were keen songwriters in the 1880's - 90's. Charles Flower's manuscripts are in the Oxley Library, Brisbane.\nRon Edwards suggests inThe Big Book of Australian Folk Song that Paterson probably got his version from the Hurd collection (1894 - 1900).\nMore recently Phillip Butterss discovered that the Hurd collection consists of cuttings taken from the Queenslander and that many of the songs in Paterson's Old Bush Songs appear to come from that source.\nThe version here is taken from the singing of A.L.Lloyd."
  },
  "provenance": {
   "collectors": [],
   "newspaper": null,
   "singers": [
    "A.L.Lloyd"
   ],
   "songbooks": [
    "book-006",
    "book-031",
    "book-102"
   ]
  },
  "related": [],
  "source": {
   "fetchedAt": "2026-09-29T07:05:56.911Z",
   "site": "afs",
   "siteId": "001",
   "siteName": "Australian Folk Songs (folkstream.com, Mark Gregory)",
   "url": "https://folkstream.com/001.html"
  },
  "text": {
   "incipit": "Hurrah for the old stock saddle, hurrah for the stockwhip too",
   "lineCount": 20,
   "stanzas": [
    [
     "Hurrah for the old stock saddle, hurrah for the stockwhip too",
     "Hurrah for the baldy pony boys to carry me westward ho",
     "To carry me westward ho my boys that's where the cattle stray",
     "On the far Barcoo where they eat Nardoo a thousand mile away"
    ],
    [
     "Then give your horses rein across the open plain",
     "We'll crack our whips like a thunderbolt nor care what some folks say",
     "And a running we'll bring home them cattle at Narome",
     "On the far Barcoo where they eat Nardoo a thousand mile away"
    ],
    [
     "Knee deep in grass we've got to pass the truth I'm bound to tell",
     "Where in three weeks them cattle get as fat as they can swell",
     "As fat as they can swell my lads a thousand pound they weigh",
     "On the far Barcoo and the Flinders too a thousand mile away"
    ],
    [
     "So fit me up with a snaffle and a four or a five inch spur",
     "And fourteen foot of greenhide whip to chop the flaming fur",
     "I'll yard them flaming cattle in away that's safe to swear",
     "I'll make them Queensland cattlemen sit back in the saddle and stare"
    ],
    [
     "Hurrah for the old stock saddle, hurrah for the stockwhip too",
     "Hurrah for the baldy pony boys to carry me westward ho",
     "To carry me westward ho my boys that's where the cattle stray",
     "On the far Barcoo where they eat Nardoo a thousand mile away"
    ]
   ],
   "wordCount": 237
  },
  "themes": [],
  "title": "A Thousand Mile Away",
  "titleAlt": [],
  "titleRaw": "A Thousand Mile Away",
  "warnings": [],
  "year": {
   "approx": false,
   "decade": "1890s",
   "from": "index",
   "value": 1894
  }
 },
 {
  "author": {
   "name": null,
   "raw": null,
   "signature": null
  },
  "id": "afs-002",
  "kind": "song",
  "location": {
   "basis": "newspaper",
   "lat": null,
   "lng": null,
   "placeId": "au/tas/formby",
   "raw": null,
   "state": "TAS",
   "town": "Formby"
  },
  "media": {
   "audio": [],
   "images": [
    {
     "height": 283,
     "role": "notation",
     "type": "gif",
     "url": "https://folkstream.com/002.gif",
     "width": 510
    }
   ],
   "midi": []
  },
  "notes": {
   "links": [
    {
     "href": "http://trove.nla.gov.au/newspaper/article/198894137",
     "text": "North West Post\""
    },
    {
     "href": "http://nla.gov.au/nla.news-article66976518",
     "text": "Advocate"
    }
   ],
   "text": "First printed in the Bulletin in May 1916.\n\nReworked from a sailor's song 'Noggin Boots' or 'Across the Western Ocean'\n\nThe song, or a related one, was also known as \"All for Me Grog\"\nwas mentioned in the Tasmanian Newspaper the North West Post\" of 20 Jul 1889.\nBANQUET AT ULVERSTONE.\n\nThe Loyal Star of the Sea Lodge, M.U., I.O.O.F.,\ncelebrated their second annual banquet at Rockliffe's Hotel, Ulverstone, on Wednesday evening\n\nBro Johnstone (Victoria) sang, \"The rolling stone gathers no moss,\" and, being re-called, \"All for my grog.\"\nThis version from the singing of A.L.Lloyd who writes \"Sung straight the song never seemed to me wildly exiting, but once I heard a drunken shearer named White sing it on a station near Bethungra NSW, in a way that would make the hair stand on end.\"\n\nIn 1925 the Tasmanian newspaper the Advocate, carried a story under the title \"The Rum Drinkers\"\n\n\"Fifteen men on the dead man's chest,\nYo, ho ho, and a bottle of rum!\nDrink and the devil had done for the rest;\nYo, ho ho, and a bottle of rum!\"\n\nIn the bad old days of the Coast, as well as other places, as far as the \"old hands\" were concerned, rum was the national drink, and many of the old fellows could swallow it like drinking new milk. In the early days of Latrobe a good many of those old fellows, who led a nomadic life, would como down to Sassafras for the harvest and potato digging, and as there were some good workers among them, at the end of the season they would have good cheques, coming to them. During the time they were working they would deny themselves various necessaries, so that, they could have a good \"rum-burst\" at the finish.\n\nWell, about. a mile out of Latrobe, on the road to Moriarty, there used to stand an old two-roomed place which was always known to us kiddies as the \"Swipers' Hut,\" and this place was often tenanted by as many as a dozen of these old follows at the one time. On wet days one of their number would be deputed to bring rum out by the gallon from Latrobe to the old camp. Needless to say, the carousals there were often fast and furious. Many a time other boys and myself would hide in the scrub that surrounded the hut, and listen to the wild singing, and, I am sorry to say, cursing that went on.\n\nThere was one little old wizened man, who looked nearly a hundred, whom we had christened \"Jimmy, the Rat.\" He used to talk in an awful squeaky kind of voice, and one of his favorite songs went, as far as I can remember, Something like this:\n\nAll for the grog, the jolly, jolly grog,\nAll for the beer and tobacco.\nThat's how I spent my tin, with the ladies, drinking gin,\nBut that sort of fun is now over.\n\nAnd from what I have heard of that man since it appears that, the song suited his character to a T, for he lived all his life just for beer and tobacco, and was found dead in a tap-room fireplace at the age of 84. Does it not seem wonderful that a man should live to such a great, age after taking so much poison into his body in the way of alcohol and nicotine? But there you are. He nearly reached the century, and had the horrors lots of times. Many a man who makes a study of his diet, slips off quietly in early life."
  },
  "provenance": {
   "collectors": [],
   "newspaper": {
    "context": "as also known as \"All for Me Grog\" was mentioned in the Tasmanian Newspaper the North West Post\" of 20 Jul 1889. BANQUET AT ULVERSTONE. The Loyal Star of t",
    "date": {
     "day": 20,
     "month": 7,
     "raw": "20 Jul 1889",
     "year": 1889
    },
    "key": "north-west-post",
    "page": null,
    "stateHint": null,
    "title": "North West Post",
    "troveArticleId": "198894137",
    "troveUrl": "http://trove.nla.gov.au/newspaper/article/198894137"
   },
   "singers": [
    "A.L.Lloyd"
   ],
   "songbooks": []
  },
  "related": [],
  "source": {
   "fetchedAt": "2026-09-29T07:05:57.940Z",
   "site": "afs",
   "siteId": "002",
   "siteName": "Australian Folk Songs (folkstream.com, Mark Gregory)",
   "url": "https://folkstream.com/002.html"
  },
  "text": {
   "incipit": "Chorus",
   "lineCount": 21,
   "stanzas": [
    [
     "Chorus",
     "Oh for me grog my jolly jolly grog",
     "Oh for me beer and tobacco",
     "Well I spent all my tin in a shanty drinking gin",
     "Now across the Western Plain I must wander"
    ],
    [
     "I'm stiff stoney broke and I've parted with me moke",
     "And the sky is looking black as flaming thunder",
     "And the shanty boss is too for I haven't got a sou",
     "That's the way you're treated when you're down and under"
    ],
    [
     "Well I'm crook in the head for I haven't been to bed",
     "Since first I touched this shanty with my plunder",
     "I see centipedes and snakes, and I'm full of pains and aches",
     "So I\"d better make a push out over yonder"
    ],
    [
     "I'll take that Old Man Plain and I'll cross it once again",
     "Until me eyes the track no longer see boys",
     "And my beer and whisky brain looks for sleep but all in vain",
     "And I feel as if I had the Darling Pea boys"
    ],
    [
     "So hang that blasted grog, that hocussed shanty grog",
     "And the beer that's loaded with tobacco",
     "Grafting humour I am in and I'll stick the peg right in",
     "And I'll settle down once more for some hard yakka"
    ]
   ],
   "wordCount": 200
  },
  "themes": [],
  "title": "Across the Western Plains",
  "titleAlt": [],
  "titleRaw": "Across the Western Plains",
  "warnings": [],
  "year": {
   "approx": false,
   "decade": "1880s",
   "from": "newspaper",
   "value": 1889
  }
 },
 {